{
  "schema_version": "0.1",
  "agent": "product_review",
  "part": {
    "name": "infotainment_display_bracket",
    "revision": "A",
    "material": "AL6061",
    "process": "sheet_metal",
    "product_family": "display_module",
    "module_type": "AVN display bracket",
    "vehicle_program": "SDV cockpit platform",
    "production_sites": [
      "Korea-Ulsan",
      "Mexico-MTY"
    ]
  },
  "summary": {
    "positioning": "preliminary_manufacturing_structure_review",
    "part_type": "bracket",
    "dfm_score": 65,
    "review_scope": "design-phase manufacturability and structure review",
    "overall_risk_level": "high",
    "primary_risks": [
      "Wall thickness 0.0mm < min 0.5mm at intersection 'base_plate'/'vertical_leg'",
      "Wall thickness 0.0mm < min 0.5mm at intersection 'base_plate'/'side_tab'",
      "No fillet or chamfer operations found — internal corners may cause stress concentration",
      "Thin wall candidate may reduce process stability during launch"
    ],
    "top_issues": [
      "Wall thickness 0.0mm < min 0.5mm at intersection 'base_plate'/'vertical_leg'",
      "Wall thickness 0.0mm < min 0.5mm at intersection 'base_plate'/'side_tab'",
      "Connector keep-out assumption is tight for line-side assembly and inspection"
    ],
    "recommended_actions": [
      "Increase wall to >= 0.5mm",
      "Add fillet (R >= 0.5mm) or chamfer to internal corners",
      "Review ribbing, bend relief, or local reinforcement before pilot tooling freeze.",
      "Reserve additional probe and hand-tool clearance or define dedicated access tooling."
    ],
    "likely_automation_candidates": [
      "auto screw presentation",
      "vision-assisted bend-angle check",
      "inline barcode traceability"
    ],
    "heuristics_notice": "Rule-based manufacturing review intended for early design-stage decision support."
  },
  "structure_signals": {
    "envelope_mm": {
      "length": 180,
      "width": 95,
      "height": 40
    },
    "feature_counts": {
      "shapes": 8,
      "boxes": 4,
      "cylinders": 4,
      "holes": 4,
      "cut_ops": 5,
      "fuse_ops": 2,
      "fillet_ops": 0,
      "chamfer_ops": 0
    },
    "thin_wall_candidates": [
      {
        "id": "base_plate",
        "thickness_mm": 2
      },
      {
        "id": "vertical_leg",
        "thickness_mm": 20
      },
      {
        "id": "side_tab",
        "thickness_mm": 18
      },
      {
        "id": "connector_window",
        "thickness_mm": 6
      }
    ],
    "drawing_strategy": []
  },
  "risk_items": [
    {
      "id": "DFM-01-1",
      "category": "dfm",
      "severity": "high",
      "title": "Wall thickness 0.0mm < min 0.5mm at intersection 'base_plate'/'vertical_leg'",
      "recommendation": "Increase wall to >= 0.5mm",
      "source": "DFM-01"
    },
    {
      "id": "DFM-01-2",
      "category": "dfm",
      "severity": "high",
      "title": "Wall thickness 0.0mm < min 0.5mm at intersection 'base_plate'/'side_tab'",
      "recommendation": "Increase wall to >= 0.5mm",
      "source": "DFM-01"
    },
    {
      "id": "DFM-04-3",
      "category": "dfm",
      "severity": "medium",
      "title": "No fillet or chamfer operations found — internal corners may cause stress concentration",
      "recommendation": "Add fillet (R >= 0.5mm) or chamfer to internal corners",
      "source": "DFM-04"
    },
    {
      "id": "heuristic-thin-wall",
      "category": "structure",
      "severity": "medium",
      "title": "Thin wall candidate may reduce process stability during launch",
      "recommendation": "Review ribbing, bend relief, or local reinforcement before pilot tooling freeze.",
      "source": "config_geometry"
    },
    {
      "id": "heuristic-connector-clearance",
      "category": "service_clearance",
      "severity": "high",
      "title": "Connector keep-out assumption is tight for line-side assembly and inspection",
      "recommendation": "Reserve additional probe and hand-tool clearance or define dedicated access tooling.",
      "source": "product_metadata"
    },
    {
      "id": "heuristic-cross-site",
      "category": "standardization",
      "severity": "medium",
      "title": "Cross-site launch requires stronger process standardization and document control",
      "recommendation": "Package PFMEA, control plan, work instruction, and gauge concept in one rollout set.",
      "source": "production_scope"
    }
  ],
  "recommendations": [
    "Increase wall to >= 0.5mm",
    "Add fillet (R >= 0.5mm) or chamfer to internal corners",
    "Review ribbing, bend relief, or local reinforcement before pilot tooling freeze.",
    "Reserve additional probe and hand-tool clearance or define dedicated access tooling.",
    "Package PFMEA, control plan, work instruction, and gauge concept in one rollout set.",
    "Evaluate auto screw presentation.",
    "Evaluate vision-assisted bend-angle check.",
    "Evaluate inline barcode traceability."
  ],
  "evidence": {
    "assumptions": [
      "Program context: SDV cockpit platform",
      "Cross-site rollout scope: Korea-Ulsan, Mexico-MTY",
      "Annual volume assumption: 180000",
      "Target cycle time assumption: 36s",
      "Decision scope: design review and pilot-line planning"
    ],
    "automation_candidates": [
      "auto screw presentation",
      "vision-assisted bend-angle check",
      "inline barcode traceability"
    ],
    "drawing_plan": {
      "schema_version": "0.1",
      "part_type": "bracket",
      "profile": "KS",
      "views": {
        "enabled": [
          "front",
          "top",
          "right",
          "iso"
        ],
        "layout": "third_angle",
        "options": {
          "front": {
            "show_hidden": true,
            "show_centerlines": true
          },
          "top": {
            "show_hidden": true,
            "show_centerlines": true
          },
          "right": {
            "show_hidden": true,
            "show_centerlines": true
          },
          "iso": {
            "show_hidden": false,
            "show_centerlines": false
          }
        }
      },
      "datums": [
        {
          "name": "A",
          "kind": "plane",
          "selector": "base_bottom_plane",
          "reason": "primary mounting face — base bottom"
        },
        {
          "name": "B",
          "kind": "axis",
          "selector": "primary_hole_axis",
          "reason": "primary hole center axis"
        }
      ],
      "dimensioning": {
        "scheme": "baseline",
        "baseline_datum": "A",
        "avoid_redundant": true,
        "auto_plan_dedupe": "smart",
        "redundancy_tol_mm": 0.5,
        "qa_weight_preset": "auto"
      },
      "dim_intents": [
        {
          "id": "WIDTH",
          "feature": "base_length",
          "view": "front",
          "style": "linear",
          "required": true,
          "priority": 100,
          "reason": "Base plate length — overall footprint",
          "value_mm": 95,
          "confidence": "high",
          "source": "shapes.vertical_leg.width",
          "review": false
        },
        {
          "id": "HEIGHT",
          "feature": "overall_height",
          "view": "front",
          "style": "linear",
          "required": true,
          "priority": 95,
          "placement": {
            "side": "left"
          },
          "reason": "Overall height (base + web) — clearance / installation",
          "value_mm": 38,
          "confidence": "high",
          "source": "shapes.vertical_leg.height",
          "review": false
        },
        {
          "id": "THK",
          "feature": "base_thickness",
          "view": "right",
          "style": "linear",
          "required": true,
          "priority": 90,
          "placement": {
            "side": "left"
          },
          "reason": "Base plate thickness — structural strength",
          "value_mm": 2,
          "confidence": "high",
          "source": "shapes.base_plate.height",
          "review": false
        },
        {
          "id": "WEB_H",
          "feature": "web_height",
          "view": "front",
          "style": "linear",
          "required": true,
          "priority": 85,
          "placement": {
            "side": "left"
          },
          "reason": "Web height — load bearing capacity",
          "value_mm": 38,
          "confidence": "high",
          "source": "shapes.vertical_leg.height",
          "review": false
        },
        {
          "id": "HOLE_DIA",
          "feature": "mounting_hole_diameter",
          "view": "front",
          "style": "diameter",
          "required": true,
          "priority": 80,
          "placement": {
            "side": "top_right",
            "angle_deg": 30,
            "offset_mm": 2
          },
          "reason": "Mounting hole diameter — fastener selection",
          "value_mm": 5,
          "confidence": "medium",
          "source": "fg.hole.hole1.diameter",
          "review": false
        },
        {
          "id": "BASE_W",
          "feature": "base_width",
          "view": "top",
          "style": "linear",
          "required": true,
          "priority": 75,
          "reason": "Base plate width — mounting footprint",
          "value_mm": 95,
          "confidence": "high",
          "source": "shapes.vertical_leg.width",
          "review": false
        },
        {
          "id": "FILLET",
          "feature": "fillet_radius",
          "view": "right",
          "style": "radius",
          "required": false,
          "priority": 40,
          "value_mm": null,
          "confidence": "none",
          "source": "no_rule",
          "review": false
        },
        {
          "id": "HOLE_SPACING",
          "feature": "hole_spacing",
          "view": "top",
          "style": "linear",
          "required": false,
          "priority": 35,
          "value_mm": null,
          "confidence": "none",